{
  "schema_version": "grouping.v2",
  "call_id": "call-fixture-04",
  "grouped_at": "2025-12-20T00:00:00.000Z",
  "decision": "new_incident",
  "incident_id": "incident-004",
  "matched_existing_incident_id": null,
  "confidence": 0.55,
  "signals": [
    {
      "type": "address_match",
      "value": "10 Market Street",
      "weight": 0.3
    },
    {
      "type": "text_similarity",
      "value": "conflicting reports",
      "weight": 0.2
    }
  ],
  "explanation": "Signals are weak and ambiguous; avoid merge.",
  "requires_review": true
}